[
  {
    "dealId": "0192f0c8-3c4e-7a2b-8c3d-4e5f6a7b8c9d",
    "role": "LA",
    "lawyerPub": "ED26D54D80051A116166CF76FEA87330D546680B875827B87AF1B1D58B9EB464E1",
    "barCommitment": "0505050505050505050505050505050505050505050505050505050505050505",
    "barSalt": "c2c2c2c2c2c2c2c2c2c2c2c2c2c2c2c2c2c2c2c2c2c2c2c2c2c2c2c2c2c2c2c2",
    "opsAccount": "rHhr2iRBgp3ZzzNH4YGQ59G7VAiGPEWj7f",
    "verificationSha256": "5353535353535353535353535353535353535353535353535353535353535353",
    "barNumber": "CA-123456"
  }
]
